0	2023-01-18 18:32:54Z	Sorry, planned but not yet available
1	2023-01-18 19:36:00Z	Create new user in Unix
2	2023-01-18 19:43:57Z	Run SQL query in one line CLI command
3	2023-01-18 20:01:54Z	JSON in SQL (mysql)
4	2023-01-18 20:08:19Z	Remove interval within called callback
5	2023-02-01 05:47:44Z	Vim quickfix list on current word
6	2023-01-18 20:18:41Z	Avoid saving not-string data to WordPress database
7	2023-02-01 07:39:30Z	The WordPress way of resolving update packages
8	2023-02-08 14:01:04Z	Malware detection in Automattic
9	2023-02-17 11:11:00Z	Loading vim quickfix list from grep
